name_product,category_product_name,description_product,price_product,stock,rating_product
"miaow Pet Hair Remover Roller ",Hygiene,Efficient Pet Hair Removal Tool for Soft Surfaces of Furniture Clothes and Decoration Easy to Operate and Maintain Simple and Environmentally Friendly,11.98,100,3.9 out of 5 stars
"Ptlom Pet Food Mat for Dog and Cat ,Food,Placemat 2 Pcs Mat for Prevent Food and Water Overflow Suitable for Medium and Small Pet Silicone 9.5""* 9.5""  ",9.99,100,4.6 out of 5 stars
24 Pieces Sympathy Loss of Pet Card  ,Accesories,Thick Sympathy Greeting Cards Pet Condolence Cards Dog Bereavement Cards with Envelopes for Dogs Cats Groomers Pet Grooming ,14.99,100,3.9 out of 5 stars
"Reopet Silicone Dog Cat   ",Food,Bowl Mat Non-Stick Food Pad Water Cushion Waterproof - Multiple Colors Sizes & Purposes,24.99,100,4.5 out of 5 stars
WOYYHO Small Pet Dog Sling  ,Accesories,Carrier Zipper Pocket Breathable Puppy Sling Carrier with Removable Bottom Adjustable Safe Dog Crossbody Carrier for Small Medium Dogs Cats Rabbit Outdoor Travel ,29.98,100,4.4 out of 5 stars
"Yacee Silicone Dog Food Mat   ",Food,Waterproof Easy Clean in Dishwasher Pet and Cat Mats 0.5" Raised Edges Placemat Tray to Stop Food Spills and Water Bowl Messes on Floor Large,14.99,100,4.6 out of 5 stars
WAKAYOYO 4 PCS Portable Lint Remover Pet Hair Remover Detachable & Reusable Pet Hair Remover   ,Hygiene,for Laundry Carpet Scraper in Plastic for Clothes Sofa Blanket & Car Mats.,11.47,100,4.6 out of 5 stars
Pet Memorial Gift Sympathy Gift for Loss Bereavement  ,Accesories,Crystal Acrylic Heart Decor Remembrance Gifts Dog Memorial Gifts Crystal Acrylic Heart Condolence Gifts for Loss of Loved One ,11.99,100,4.9 out of 5 stars
